{
  "$schema": "http://json-schema.org/draft-07/schema#",
  "title": "Symptom Mappings Initial Schema",
  "description": "Maps VAERS symptoms to PDF adverse events",
  "type": "array",
  "items": {
    "type": "object",
    "properties": {
      "canonical_symptom": {"type": "string", "description": "Standardized symptom name (from PDF)"},
      "vaers_symptom": {"type": "string", "description": "Original VAERS symptom"},
      "vaccine_name": {"type": "string", "description": "Vaccine this mapping applies to"},
      "vaers_count": {"type": "integer", "description": "Number of times VAERS symptom was reported"},
      "mapping_confidence": {"type": "string", "enum": ["exact_match", "synonym", "related"], "description": "Confidence level of mapping"}
    },
    "required": ["canonical_symptom", "vaers_symptom", "vaccine_name", "vaers_count", "mapping_confidence"]
  }
}