[
  {
    "canonical_symptom": "myalgia",
    "vaers_symptom": "Limb discomfort",
    "vaccine_name": "SHINGRIX (ZOSTER VACCINE RECOMBINANT, ADJUVANTED)",
    "vaers_count": 186,
    "mapping_confidence": "related"
  },
  {
    "canonical_symptom": "swelling",
    "vaers_symptom": "Swelling of eyelid",
    "vaccine_name": "SHINGRIX (ZOSTER VACCINE RECOMBINANT, ADJUVANTED)",
    "vaers_count": 49,
    "mapping_confidence": "synonym"
  },
  {
    "canonical_symptom": "gastrointestinal symptoms",
    "vaers_symptom": "Diarrhoea",
    "vaccine_name": "SHINGRIX (ZOSTER VACCINE RECOMBINANT, ADJUVANTED)",
    "vaers_count": 855,
    "mapping_confidence": "related"
  },
  {
    "canonical_symptom": "drowsiness",
    "vaers_symptom": "Somnolence",
    "vaccine_name": "HEPATITIS A (HAVRIX)",
    "vaers_count": 20,
    "mapping_confidence": "related"
  },
  {
    "canonical_symptom": "redness",
    "vaers_symptom": "Swelling",
    "vaccine_name": "HEPATITIS A (HAVRIX)",
    "vaers_count": 37,
    "mapping_confidence": "related"
  },
  {
    "canonical_symptom": "redness",
    "vaers_symptom": "Injection site erythema",
    "vaccine_name": "HEPATITIS A (HAVRIX)",
    "vaers_count": 170,
    "mapping_confidence": "related"
  },
  {
    "canonical_symptom": "pain",
    "vaers_symptom": "Pain in extremity",
    "vaccine_name": "HEPATITIS A (HAVRIX)",
    "vaers_count": 59,
    "mapping_confidence": "synonym"
  },
  {
    "canonical_symptom": "body ache or muscle weakness",
    "vaers_symptom": "Myalgia",
    "vaccine_name": "TETANUS TOXOID, REDUCED DIPHTHERIA TOXOID AND ACELLULAR PERTUSSIS VACCINE ADSORBED (ADACEL)",
    "vaers_count": 77,
    "mapping_confidence": "related"
  },
  {
    "canonical_symptom": "body ache or muscle weakness",
    "vaers_symptom": "Discomfort",
    "vaccine_name": "TETANUS TOXOID, REDUCED DIPHTHERIA TOXOID AND ACELLULAR PERTUSSIS VACCINE ADSORBED (ADACEL)",
    "vaers_count": 23,
    "mapping_confidence": "synonym"
  },
  {
    "canonical_symptom": "injection site swelling",
    "vaers_symptom": "Oedema peripheral",
    "vaccine_name": "TETANUS TOXOID, REDUCED DIPHTHERIA TOXOID AND ACELLULAR PERTUSSIS VACCINE ADSORBED (ADACEL)",
    "vaers_count": 17,
    "mapping_confidence": "related"
  },
  {
    "canonical_symptom": "injection site swelling",
    "vaers_symptom": "Inflammation",
    "vaccine_name": "TETANUS TOXOID, REDUCED DIPHTHERIA TOXOID AND ACELLULAR PERTUSSIS VACCINE ADSORBED (ADACEL)",
    "vaers_count": 19,
    "mapping_confidence": "related"
  },
  {
    "canonical_symptom": "injection site swelling",
    "vaers_symptom": "Injection site swelling",
    "vaccine_name": "TETANUS TOXOID, REDUCED DIPHTHERIA TOXOID AND ACELLULAR PERTUSSIS VACCINE ADSORBED (ADACEL)",
    "vaers_count": 306,
    "mapping_confidence": "exact_match"
  },
  {
    "canonical_symptom": "injection site swelling",
    "vaers_symptom": "Swelling",
    "vaccine_name": "TETANUS TOXOID, REDUCED DIPHTHERIA TOXOID AND ACELLULAR PERTUSSIS VACCINE ADSORBED (ADACEL)",
    "vaers_count": 106,
    "mapping_confidence": "synonym"
  },
  {
    "canonical_symptom": "Fever",
    "vaers_symptom": "Feeling hot",
    "vaccine_name": "DIPHTHERIA AND TETANUS TOXOIDS AND ACELLULAR PERTUSSIS ADSORBED AND INACTIVATED POLIOVIRUS VACCINE (KINRIX)",
    "vaers_count": 11,
    "mapping_confidence": "related"
  },
  {
    "canonical_symptom": "Gastroenteritis",
    "vaers_symptom": "Diarrhoea",
    "vaccine_name": "DIPHTHERIA AND TETANUS TOXOIDS AND ACELLULAR PERTUSSIS ADSORBED AND INACTIVATED POLIOVIRUS VACCINE (KINRIX)",
    "vaers_count": 18,
    "mapping_confidence": "related"
  },
  {
    "canonical_symptom": "Swelling",
    "vaers_symptom": "Peripheral swelling",
    "vaccine_name": "DIPHTHERIA AND TETANUS TOXOIDS AND ACELLULAR PERTUSSIS ADSORBED AND INACTIVATED POLIOVIRUS VACCINE (KINRIX)",
    "vaers_count": 77,
    "mapping_confidence": "synonym"
  },
  {
    "canonical_symptom": "increase in arm circumference",
    "vaers_symptom": "Peripheral swelling",
    "vaccine_name": "DIPHTHERIA AND TETANUS TOXOIDS AND ACELLULAR PERTUSSIS ADSORBED, INACTIVATED POLIOVIRUS AND HAEMOPHILUS B CONJUGATE (TETANUS TOXOID CONJUGATE) VACCINE (PENTACEL)",
    "vaers_count": 27,
    "mapping_confidence": "synonym"
  },
  {
    "canonical_symptom": "tenderness",
    "vaers_symptom": "Erythema",
    "vaccine_name": "DIPHTHERIA AND TETANUS TOXOIDS AND ACELLULAR PERTUSSIS ADSORBED, INACTIVATED POLIOVIRUS AND HAEMOPHILUS B CONJUGATE (TETANUS TOXOID CONJUGATE) VACCINE (PENTACEL)",
    "vaers_count": 64,
    "mapping_confidence": "related"
  },
  {
    "canonical_symptom": "increase in arm circumference",
    "vaers_symptom": "Injection site swelling",
    "vaccine_name": "DIPHTHERIA AND TETANUS TOXOIDS AND ACELLULAR PERTUSSIS ADSORBED, INACTIVATED POLIOVIRUS AND HAEMOPHILUS B CONJUGATE (TETANUS TOXOID CONJUGATE) VACCINE (PENTACEL)",
    "vaers_count": 76,
    "mapping_confidence": "synonym"
  },
  {
    "canonical_symptom": "loss of appetite",
    "vaers_symptom": "Hypophagia",
    "vaccine_name": "DIPHTHERIA AND TETANUS TOXOIDS AND ACELLULAR PERTUSSIS ADSORBED, HEPATITIS B (RECOMBINANT) AND INACTIVATED POLIOVIRUS VACCINE (PEDIARIX)",
    "vaers_count": 10,
    "mapping_confidence": "related"
  },
  {
    "canonical_symptom": "skin disorder",
    "vaers_symptom": "Rash pruritic",
    "vaccine_name": "ZOSTER VACCINE LIVE (ZOSTAVAX)",
    "vaers_count": 11,
    "mapping_confidence": "related"
  },
  {
    "canonical_symptom": "headache",
    "vaers_symptom": "Headache",
    "vaccine_name": "ZOSTER VACCINE LIVE (ZOSTAVAX)",
    "vaers_count": 49,
    "mapping_confidence": "exact_match"
  },
  {
    "canonical_symptom": "asthenia",
    "vaers_symptom": "Malaise",
    "vaccine_name": "ZOSTER VACCINE LIVE (ZOSTAVAX)",
    "vaers_count": 15,
    "mapping_confidence": "related"
  },
  {
    "canonical_symptom": "asthenia",
    "vaers_symptom": "Asthenia",
    "vaccine_name": "ZOSTER VACCINE LIVE (ZOSTAVAX)",
    "vaers_count": 28,
    "mapping_confidence": "exact_match"
  },
  {
    "canonical_symptom": "injection-site reactions",
    "vaers_symptom": "Swelling",
    "vaccine_name": "ZOSTER VACCINE LIVE (ZOSTAVAX)",
    "vaers_count": 10,
    "mapping_confidence": "related"
  },
  {
    "canonical_symptom": "respiratory disorder",
    "vaers_symptom": "Cough",
    "vaccine_name": "ZOSTER VACCINE LIVE (ZOSTAVAX)",
    "vaers_count": 17,
    "mapping_confidence": "related"
  },
  {
    "canonical_symptom": "respiratory disorder",
    "vaers_symptom": "Dyspnoea",
    "vaccine_name": "ZOSTER VACCINE LIVE (ZOSTAVAX)",
    "vaers_count": 29,
    "mapping_confidence": "related"
  },
  {
    "canonical_symptom": "skin disorder",
    "vaers_symptom": "Rash erythematous",
    "vaccine_name": "ZOSTER VACCINE LIVE (ZOSTAVAX)",
    "vaers_count": 12,
    "mapping_confidence": "related"
  },
  {
    "canonical_symptom": "redness",
    "vaers_symptom": "Injection site warmth",
    "vaccine_name": "DIPHTHERIA AND TETANUS TOXOIDS AND ACELLULAR PERTUSSIS (INFANRIX)",
    "vaers_count": 87,
    "mapping_confidence": "related"
  },
  {
    "canonical_symptom": "redness",
    "vaers_symptom": "Rash pruritic",
    "vaccine_name": "DIPHTHERIA AND TETANUS TOXOIDS AND ACELLULAR PERTUSSIS (INFANRIX)",
    "vaers_count": 11,
    "mapping_confidence": "related"
  },
  {
    "canonical_symptom": "redness",
    "vaers_symptom": "Rash",
    "vaccine_name": "DIPHTHERIA AND TETANUS TOXOIDS AND ACELLULAR PERTUSSIS (INFANRIX)",
    "vaers_count": 88,
    "mapping_confidence": "related"
  },
  {
    "canonical_symptom": "redness",
    "vaers_symptom": "Vaccination site erythema",
    "vaccine_name": "DIPHTHERIA AND TETANUS TOXOIDS AND ACELLULAR PERTUSSIS (INFANRIX)",
    "vaers_count": 11,
    "mapping_confidence": "related"
  },
  {
    "canonical_symptom": "pain",
    "vaers_symptom": "Pain in extremity",
    "vaccine_name": "DIPHTHERIA AND TETANUS TOXOIDS AND ACELLULAR PERTUSSIS (INFANRIX)",
    "vaers_count": 22,
    "mapping_confidence": "synonym"
  },
  {
    "canonical_symptom": "swelling",
    "vaers_symptom": "Peripheral swelling",
    "vaccine_name": "DIPHTHERIA AND TETANUS TOXOIDS AND ACELLULAR PERTUSSIS (INFANRIX)",
    "vaers_count": 37,
    "mapping_confidence": "synonym"
  },
  {
    "canonical_symptom": "redness",
    "vaers_symptom": "Injection site erythema",
    "vaccine_name": "DIPHTHERIA AND TETANUS TOXOIDS AND ACELLULAR PERTUSSIS (INFANRIX)",
    "vaers_count": 232,
    "mapping_confidence": "related"
  },
  {
    "canonical_symptom": "fever",
    "vaers_symptom": "Feeling hot",
    "vaccine_name": "DIPHTHERIA AND TETANUS TOXOIDS AND ACELLULAR PERTUSSIS (INFANRIX)",
    "vaers_count": 10,
    "mapping_confidence": "related"
  },
  {
    "canonical_symptom": "drowsiness",
    "vaers_symptom": "Lethargy",
    "vaccine_name": "DIPHTHERIA AND TETANUS TOXOIDS AND ACELLULAR PERTUSSIS VACCINE ADSORBED (DAPTACEL)",
    "vaers_count": 32,
    "mapping_confidence": "related"
  },
  {
    "canonical_symptom": "tenderness",
    "vaers_symptom": "Pain in extremity",
    "vaccine_name": "DIPHTHERIA AND TETANUS TOXOIDS AND ACELLULAR PERTUSSIS VACCINE ADSORBED (DAPTACEL)",
    "vaers_count": 67,
    "mapping_confidence": "related"
  },
  {
    "canonical_symptom": "swelling",
    "vaers_symptom": "Injection site swelling",
    "vaccine_name": "DIPHTHERIA AND TETANUS TOXOIDS AND ACELLULAR PERTUSSIS VACCINE ADSORBED (DAPTACEL)",
    "vaers_count": 176,
    "mapping_confidence": "synonym"
  },
  {
    "canonical_symptom": "redness",
    "vaers_symptom": "Erythema",
    "vaccine_name": "DIPHTHERIA AND TETANUS TOXOIDS AND ACELLULAR PERTUSSIS VACCINE ADSORBED (DAPTACEL)",
    "vaers_count": 75,
    "mapping_confidence": "related"
  },
  {
    "canonical_symptom": "injection-site erythema",
    "vaers_symptom": "Injection site erythema",
    "vaccine_name": "HUMAN PAPILLOMAVIRUS QUADRIVALENT (TYPES 6, 11, 16, AND 18) VACCINE, RECOMBINANT (GARDASIL)",
    "vaers_count": 10,